{
  "page_number": 1,
  "page_size": 25,
  "objects_count": 3,
  "objects": [
    {
      "id": 1,
      "id_str": "1",
      "name": "accept_list_1",
      "applications": [
        {
          "application_id": 1,
          "application_id_str": "1",
          "access": "restricted",
          "attached_rules": {
            "skip": 0,
            "overriding_accept": 0,
            "refuse": 0,
            "review": 0,
            "accept": 2,
            "trust": 1
          }
        }
      ],
      "display_name": "IP Address & Domain Accept List",
      "active_items_count": 9,
      "expired_items_count": 1,
      "fields": [
        {
          "name": "Accepted IP Address",
          "type": "IP_ADDRESS"
        },
        {
          "name": "Accepted CIDR",
          "type": "CIDR"
        }
      ]
    },
    {
      "id": 2,
      "id_str": "2",
      "name": "refuse_list_1",
      "applications": [
        {
          "application_id": 1,
          "application_id_str": "1",
          "access": "restricted",
          "attached_rules": {
            "skip": 0,
            "overriding_accept": 0,
            "refuse": 2,
            "review": 0,
            "accept": 0,
            "trust": 0
          }
        }
      ],
      "display_name": "Phone No. Refuse List",
      "active_items_count": 215,
      "expired_items_count": 25,
      "fields": [
        {
          "name": "Banned Phone No.",
          "type": "PHONE_NUMBER"
        }
      ]
    },
    {
      "id": 3,
      "id_str": "3",
      "name": "simple_list",
      "applications": [
        {
          "application_id": 1,
          "application_id_str": "1",
          "access": "restricted",
          "attached_rules": {
            "skip": 0,
            "overriding_accept": 0,
            "refuse": 0,
            "review": 3,
            "accept": 0,
            "trust": 0
          }
        }
      ],
      "display_name": "simple_list",
      "active_items_count": 1,
      "expired_items_count": 0,
      "fields": [
        {
          "name": "ISO-3166 Country code",
          "type": "COUNTRY_CODE"
        },
        {
          "name": "ISO-4217 Currency code ",
          "type": "CURRENCY"
        },
        {
          "name": "Accepted Bank Identification Number",
          "type": "BIN"
        }
      ]
    }
  ]
}
