{
  "page_number": 1,
  "page_size": 25,
  "objects_count": 2,
  "objects": [
    {
      "id": 1,
      "id_str": "1",
      "values": ["PL"],
      "list_id": 4,
      "list_id_str": "4",
      "created_at": "2024-04-11",
      "expires_at": null,
      "expired": false,
      "created_by": {
        "id": 11,
        "id_str": "11",
        "name": "user@example.com"
      },
      "comment": "Added due to our customer fraud policy."
    },
    {
      "id": 2,
      "id_str": "2",
      "values": ["DE"],
      "list_id": 4,
      "list_id_str": "4",
      "created_at": "2023-01-10",
      "expires_at": "2023-11-11",
      "expired": true,
      "created_by": {
        "id": 11,
        "id_str": "11",
        "name": "user@example.com"
      },
      "comment": null
    }
  ]
}
